subject,sendings,opens,open_rate
Wall Décor from just $3.74 for you! &#x1f49d;,179455,52510,0.292608175
3-for-2 on our favourite gift ideas &#x2728; Don't miss out!,179364,51932,0.289534132
&#x23f0; Last chance: Canvas Prints & Photo Gifts up to 87% off,179218,47879,0.267155085
Super size your savings: bigger Canvas = bigger discount! | From £3.83,179116,52036,0.290515643
Last chance &#x2764;&#xfe0f; Valentine’s SALE with top products!,177900,51240,0.288026981
&#x1f381; Your perfect gift from just £3.40 – don’t miss out!,177516,50104,0.282250614
Today only: Labour Day Sale with up to 20% off! &#x23f3;,177498,46427,0.261563511
" $5,  $7, or $10 discount on ALL Photo Products – only until tomorrow!",176831,46912,0.26529285
"{{ contact.1 }}, take a look: Your photo in the product gallery ",176670,66276,0.375140092
{% if contact.1 == '{{ contact.1 }}'' %}{% if contact.1 == true %}{{ contact.1 }}'s {% else %}Your {% endif %}{% else %}{% if contact.1 == true %}{{ contact.1 }}'s {% else %}Your {% endif %}{% endif %}Showroom with up to -85% is waiting!,176144,39468,0.224066673
Only 48 hours! Stunning Canvases starting at $4!,175863,46577,0.264848206
Your favorite photos on Canvas: 6 sizes starting at just $10! &#x1f4f8;,175785,54645,0.310862702
&#x1f929; Print Days SALE – Bestsellers from just £2.40! ,175748,39200,0.223046635
"&#x1f514; Final 48 hours{% if contact.1 == '{{ contact.1 }}' %}{% if contact.1 == true %}, {{ contact.1 }}! {% else %}! {% endif %}{% else %}{% if contact.1 == true %}, {{ contact.1 }}! {% else %}! {% endif %}{% endif %}Claim your -86% ""Thank You"" discount!",175540,39116,0.222832403
Last hours: Save up to 87% on Canvas Prints!,175460,50810,0.289581671
4th of July Sale | Only until midnight!,174188,47235,0.271172526
Exclusive offer: up to 87% off on unique Photo Products!,173972,50856,0.292322903
&#x1f525; Final remainder: Canvas Sale + EXTRA savings – starting at $3.74!,173780,62084,0.357256301
From $3.87 I Save big before it’s over!,173348,42432,0.244779288
Up to 90% off on Canvas Prints & Photo Gifts!,173240,41904,0.241884091
2 days only | Enjoy top Valentine's discounts!,172896,48324,0.279497501
Finally sale again &#x1f60d; EVERYTHING reduced up to 25%,172350,37537,0.217795184
"New Year, new home: Wall Décor from only $2.73!",172164,48220,0.280081782
"Your ""Thank You"" offer ends soon! &#x23f3;",172092,63228,0.367408131
Expires soon! Bestselling Photo Products from £5,171388,41476,0.242000607
Get a FREE Canvas Print!,171272,66424,0.387827549
Buy now or cry later &#x1f494; | Black Friday at CANVASONSALE,170962,59660,0.348966437
"&#x1f4a5; {% if contact.1 == true %}{{ contact.1 }}, act {% else %}Act {% endif %}fast! Up to 90% off Bestsellers ends today!",170792,41224,0.241369619
"Free shipping &#x1f389; And 70% off on everything, {{ contact.1 }}!",170616,59957,0.351414873
&#x1f337;Show your love with Photo Gifts! Save up to 92% in Mother’s Day Sale!,170189,40626,0.23871108
Revive your walls! Get up to 5 FREE Photo Tiles!,169328,61134,0.36103893
Only until midnight &#x23f0; Celebrate Labor Day with savings up to 75%!,168875,46990,0.278253146
Valentine's Day offer expires! Gifts from $6,168540,61230,0.363296547
Your SALE offer with up to 93% off expires &#x1f440; Grab it now!,168440,51040,0.303015911
Victoria Day Sale: Up to 15% OFF everything!,166548,35784,0.214856978
Less than 24h left | Don’t miss up to 87% off Wall Décor!,166147,53876,0.324267065
"{% if contact.1 == '' %}{% if contact.1 == true %} {{ contact.1 }}, your {% else %}Your {% endif %}{% else %}{% if contact.1 == true %} {{ contact.1 }}, your {% else %}Your {% endif %}{% endif %} code &#x1f525; CA1ST25CRM &#x1f525;| Double savings guaranteed!",165364,42611,0.257680027
Ending Soon: Up to 87% Off on Wall Décor! &#x1f6a8;,165340,49320,0.298294424
Photo Blankets at the lowest prices of the year – claim yours now!,165324,44448,0.268853887
Unlock EXTRA savings with code VUKDMLS6,164468,42968,0.261254469
&#x1f6a8; Final call: Your FREE Canvas Print offer ends tonight,164424,66111,0.402076339
Perfect gift for the dad who has everything!,164112,45416,0.276737838
&#x26a1; Photo Products starting at $4.50 – Don’t miss out!,164052,47736,0.290980908
"Mystery deal!&#x2753;What's your secret discount, {{ contact.1 }}?",163615,58551,0.357858387
&#x23f3; Last chance: Up to 87% off on Canvas Prints and Photo Products!,162636,42676,0.262401928
"{% if contact.1 == true %}{{ contact.1 }}, get{% else %}Get{% endif %} the LOWEST prices on Acrylic Prints during our Memorial Day Sale!",162600,58814,0.361709717
"&#x1f680; Attention{% if contact.1 == '' %}{% if contact.1 == true %}, {{ contact.1 }}! {% else %}! {% endif %}{% else %}{% if contact.1 == true %}, {{ contact.1 }}! {% else %}! {% endif %}{% endif %}This deal is about to expire!",162588,57420,0.353162595
"{% if contact.1 == true %}{{ contact.1 }}, kick{% else %}Kick{% endif %} off Mother’s Day with gifts from only $5",161696,56807,0.351319761
Expires soon! Bestselling Photo Products from $9.60,161130,43016,0.266964563
 &#x1f4e2; Your Wall & Home Décor discounts expire tomorrow!,160815,43728,0.271914933
&#x1f4f8; Camera Day! 15% discount - expires today!,158065,42240,0.267231835
Bestselling Wall Décor from £3.83 - Offer ends soon!,157110,45328,0.288511234
SALE from $6 | Discounts up to 77% in your Showroom!,156926,49380,0.314670609
FREE SHIPPING! &#x1f69a; Start thinking about Mother's Day and save!,156924,39020,0.2486554
Valentine's Day offer expires! Gifts from $4.24,156362,50584,0.323505711
Get up to 83% OFF before it's gone {{ contact.1 }}!,156320,57232,0.366120778
"{% if contact.1 == true %}Reminder, {{ contact.1 }}: {% else %}Reminder: {% endif %}your code AA8SCGJK is about to expire! &#x1f31f;",156040,59300,0.380030761
This deal was too good to end – so we brought it back!,155855,34020,0.218279811
YOU deserve this deal: 6 perfect Canvas Print sizes up to 87% off!,155845,39450,0.253136129
Until midnight! Lowest prices on ALL Canvases!,155448,53217,0.342345994
"{% if contact.1 == '' %}{% if contact.1 == true %} {{ contact.1 }}, your {% else %}Your {% endif %}{% else %}{% if contact.1 == true %} {{ contact.1 }}, your {% else %}Your {% endif %}{% endif %}code &#x1f525; CS1ST25CRM &#x1f525; | Double savings guaranteed!",152987,52009,0.33995699
Our team's must-haves – starting at $X&#x2764;&#xfe0f;  ,152460,52974,0.347461629
From C$3.51 &#x1f31e; Victoria Day Sale! ,152450,37840,0.248212529
&#x1f6a8; New sale: Wall Decorations discounted by up to 86%!,152422,81749,0.536333338
"A little ""thank you"" treat! | Up to -75% off on Wall Décor",151938,51372,0.338111598
"Last day to get Canvases from $8.50{% if contact.1 == true %}, {{ contact.1 }}!{% else %}!{% endif %} &#x1f6a8;",151840,55080,0.362750263
Unmissable Father’s Day Sale: up to 81% off everything,151772,52510,0.345979496
"{% if contact.1 == true %}{{ contact.1 }}, {% else %}{% endif %}Valentine’s Day savings ends tonight!",151612,54046,0.356475741
Mother's Day delivery &#x1f490; Photo books with up to  -15% EXTRA | Calendars with -10% EXTRA! ,151430,47550,0.314006472
Hug Day special: discounts of up to 87%,151426,52547,0.347014383
"{% if contact.1 == '' %}{% if contact.1 == true %} {{ contact.1 }}, your {% else %}Your {% endif %}{% else %}{% if contact.1 == true %} {{ contact.1 }}, your {% else %}Your {% endif %}{% endif %}code &#x1f525; CS1ST24CRM &#x1f525; | Double savings guaranteed!",151048,47235,0.312715163
Lovely Father's Day gifts starting at only $8,149964,36594,0.244018564
Celebrate the Womans Day - Canvas prints from $10.90 &#x1f339;,149904,81306,0.542387128
"Last call{% if contact.1 == '' %}{% if contact.1 == true %}, {{ contact.1 }}!{% else %}!{% endif %}{% else %}{% if contact.1 == true %}, {{ contact.1 }}!{% else %}!{% endif %}{% endif %} Massive savings on our Bestsellers await!",149337,48861,0.327186163
"&#x1f60d; New products have entered the SALE | Grab ’em now{% if contact.1 == '{{ contact.1 }}' %}{% if contact.1 == true %}, {{ contact.1 }}!{% else %}!{% endif %}{% else %}{% if contact.1 == true %}, {{ contact.1 }}!{% else %}!{% endif %}{% endif %}",149048,45784,0.307176212
Celebrate with savings: Up to 86% OFF until midnight!,148560,43102,0.290131933
"{% if contact.1 == true %} {{ contact.1 }}, code {% else %} Code {% endif %} AA8SCGJK expires at midnight!",148486,52224,0.351709926
"&#x1f381; FREE product of your choice{% if contact.1 == '' %}{% if contact.1 == true %}, {{ contact.1 }}{% else %}{% endif %}{% else %}{% if contact.1 == true %}, {{ contact.1 }}{% else %}{% endif %}{% endif %} | Black Friday continues!",148248,46056,0.310668609
Don’t forget – our Father’s Day Sale is on!,147762,27664,0.187219989
&#x1f6a8; Last chance! Grab Wall Décor from only $2.73,147485,44364,0.300803472
&#x1f381; Unlock Your Valentine’s Mystery Discount!,147068,45746,0.31105339
Prime Deal alert: lowest Canvas prices of the season,146462,28304,0.193251492
One more day! Gifts from C$3.32,145885,39530,0.270966857
"Your code &#x1f4a5;VND48QE4&#x1f4a5; expires soon! Redeem it now{% if contact.1 == true %}, {{ contact.1 }}! {% else %}! {% endif %}",145672,45744,0.314020539
VIP Exclusive! Early Black Friday deals from C$5.99 &#x1f4b0;,145490,38800,0.266684996
(48h) Transform your space from just C$6.57 – time’s running out!,144774,44206,0.305344882
"{% if contact.1 == '' %}{% if contact.1 == true %} {{ contact.1 }}, make {% else %}Make {% endif %}{% else %}{% endif %}Mother's Day unforgettable | From only $4! &#x1f490;",144386,39149,0.271141246
Last chance: Father's Day gifts starting from C$3.51 &#x2764;&#xfe0f;,143715,40600,0.282503566
"{% if contact.1 == '' %}{% if contact.1 == true %}{{ contact.1 }}, act {% else %}Act{% endif %}{% else %}{% if contact.1 == true %}{{ contact.1 }}, act {% else %}Act{% endif %}{% endif %}fast! Your discount of up to 92% expires today &#x23f0;",143586,52800,0.367723873
The perfect gift for Dad –  from just $3,143124,50016,0.34945921
"MEGA Sale from C$6.57 | Canvas with size discount{% if contact.1 == '' %}{% if contact.1 == true %}, {{ contact.1 }}! {% else %}! {% endif %}{% else %}{% if contact.1 == true %}, {{ contact.1 }}! {% else %}! {% endif %}{% endif %}",142656,43770,0.306822005
"Last chance to claim your VIP ""Thank You"" discount - up to 80% off!",142574,47924,0.336134218
&#x23f3; Mother's Day deal ends today! From C$3.71,141855,41065,0.289485742
48h | Hurry up to save up to 87% on Wall Décor! ,141604,39276,0.277365046
Still in time for Mother's Day! &#x23f0; Canvas Sale until midnight,141270,40990,0.290153607
&#x1f3f7;&#xfe0f; Prices start at just $5! Shop our BESTSELLERS now!,141260,41710,0.295271131
MEGA sale from C$6.57 | Canvases with size discount,141040,40674,0.288386273
Labour Day Sale: Wall Décor from only C$5.84 ,140184,45676,0.325828911
&#x1f4e2; Last chance | Wall Décor from $6 ,138905,37440,0.269536734
"MEGA sale from C$6.57 | Canvases with size discount{% if contact.1 == '' %}{% if contact.1 == true %}, {{ contact.1 }}! {% else %}! {% endif %}{% else %}{% if contact.1 == true %}, {{ contact.1 }}! {% else %}! {% endif %}{% endif %}",138660,37140,0.267849416
"{% if contact.1 == true %}{{ contact.1 }}, this{% else %}This{% endif %} is your last shot at 81% off Father’s Day gifts!",138607,49098,0.354224534
"Are you really going to miss this massive discount{% if contact.1 == true %, }{{ contact.1 }}?{% else %}?{% endif %}",138219,39384,0.284939118
Wow! All Wall Decorations with up to -81%! ,138201,39597,0.286517464
Valentine's Day SALE: Up to -45% EXTRA on ALL Canvas Prints! &#x1f495;,137280,39339,0.286560315
Mother’s Day Sale! Open for lowest prices!,137246,37430,0.272721974
2 days &#x2728; Canvas Prints from $7,136147,35700,0.262216575
&#x23f0; 48h | Hurry up to save up to 87% on  Wall & Home Décor! ,135784,34512,0.254168385
Take your chance! Unique Photo Products from only $10,135450,5380,0.039719454
Only for you! 70% discount + FREE Shipping!,133355,36696,0.275175284
Only today &#x23f3; Black Friday discounts from £3.60!,133296,34884,0.261703277
Hurry! Mother’s Day Sale on ALL canvas sizes ends!,132560,36710,0.276931201
Until midnight! Canvas Prints from $3.50 | On-time delivery for Mother’s Day,132540,35700,0.269352648
From only $5 &#x26a1; Get the lowest prices of 2025 while you can!,132214,44485,0.336462099
&#x2600;&#xfe0f; Summer SALE! Get up to C$15 off your order!,131605,25583,0.19439231
Prime Deals wrap-up: Save up to 92%!,130351,39283,0.301363242
Mother's Day SALE: up to -15% on ALL Canvases!&#x1f495;,130074,29020,0.223103772
&#x1f929; Print Days Sale: Save up to 15%,129777,28108,0.216586914
Until midnight &#x23f1;&#xfe0f; Save up to -87% now,129087,34887,0.270259592
"&#x1f31f; {% if contact.1 == '' %}{% if contact.1 == true %}{{ contact.1 }}, spin {% else %}Spin {% endif %}{% else %}{% if contact.1 == true %}{{ contact.1 }}, spin {% else %}Spin {% endif %}{% endif %}the wheel for exclusive Prizes!",128781,30732,0.238637687
"Your VIP invite: FREE 8""x12"" Canvas Print",127824,50448,0.394667668
Gift: FREE SHIPPING on your order! &#x1f381; Shop now!,127677,43488,0.340609507
&#x1f3f7;&#xfe0f; Prices start at just $ 5! Shop our BESTSELLERS now!,127134,37539,0.295271131
&#x23f0; Last Chance! Prices from $7 - Shop Bestsellers Now!,126513,37296,0.294799744
Just days left! Personalized gifts from C$3.32,126213,22736,0.180139922
(24h) Home Décor at great prices! From $10,125900,42390,0.33669579
Huge Memorial Day savings: don't miss out{% if contact.1 == true %} {{ contact.1 }}!{% else %}!{% endif %},125785,43990,0.349723735
Kickstart your year with memories! &#x2763;&#xfe0f; Enjoy 15% off custom photo calendars!,124059,39843,0.321161705
&#x23f3; Only until midnight: up to 87% OFF + Delivery Guarantee for Mother's Day,123520,33904,0.274481865
Just for you: C$10 off your next order—don’t wait!,123410,34049,0.275901467
"{% if contact.1 == '' %}{% if contact.1 == true %}{{ contact.1 }}, find{% else %}Find {% endif %}{% else %}{% if contact.1 == true %}{{ contact.1 }}, find{% else %}Find {% endif %}{% endif %}  your Father’s Day gift inspiration - SPECIAL discount!",123063,39099,0.317715317
Show your love &#x1f495; Canvas Prints from C$6.57,122928,41446,0.33715671
&#x23f3;Until tomorrow: Wall Decor discount up to 82%,122668,43232,0.352430952
Mother's Day gifts from $5,121715,44630,0.366676252
&#x1f525; Christmas Savings: Everything is discounted!,121400,60536,0.498649094
Show your love &#x2764;&#xfe0f; Valentine’s Day SALE on all our products!,121086,46783,0.386361759
It’s Canada Day! Celebrate with 10% OFF everything!,119479,29934,0.250537751
&#x23f0; Only until midnight: Save up to 87% on Canvas Prints,119146,37555,0.315201517
End the year with a bang &#x1f4a5; Unbeatable deals inside!,118655,34328,0.289309342
Expires today: Canvas for just $25.20!,118644,38958,0.328360473
Gift: $9.99 discount on your order! &#x1f381; Shop now!,118296,41016,0.346723473
&#x23f3; Countdown is on! Bestsellers up to 93% off until midnight!,117733,31472,0.267316725
&#x1f4a5;Last chance: Save up to 87% on Cozy Blankets and Wall Décor,117698,31248,0.265493042
"Mega discount on Best-Selling Wall Décor – hurry, before It's gone!",117400,42645,0.363245315
&#x23f3; (24h) Father's Day Flash Sale: up to 88% OFF on Canvas Prints and Collages!,116990,32532,0.278075049
&#x1f55b; Last hours: Bestsellers from $6!,116555,37525,0.32195101
Until midnight! Sale on ALL Canvas Prints!,116178,38684,0.332971819
"{% if contact.1 == '' %}{% if contact.1 == true %}, {{ contact.1 }}, check {% else %}Check{% endif %}{% else %}{% if contact.1 == true %}, {{ contact.1 }}, check {% else %}Check{% endif %}{% endif %}this out: Your photo in the product gallery | SALE starts at $3",115510,31656,0.274054194
(48h) We say Thank You! | Up to 95% off Wall Decorations,115379,35421,0.306996941
Flash Sale: Metal Prints just $8.99 (were $51!),115250,34911,0.302915401
Last chance: Amazing deals on Wall Décor starting from just $3.74!,115238,35068,0.304309342
Wrap up the year with 15% off Calendars & Photo Books from just $5.00!,114088,33913,0.297252998
&#x23f1;&#xfe0f; The clock is ticking… EXTRA 30% off ends soon!,113995,36197,0.317531471
It's Camera Day! Up to -75% on  Wall Décor,113711,32422,0.285126329
Hurry! Valentine’s Day Canvas Sale—prices as low as C$6.57!,113616,31448,0.276792001
"{% if contact.1 == true %}{{ contact.1 }}, MEGA{% else %}MEGA{% endif %} SALE ends at tomorrow - hurry!",113347,37959,0.334891969
&#x1f384;2nd Advent Deal: Everything is reduced!,113292,34920,0.30823006
Ends tomorrow! FREE Shipping + 70% OFF everything!,113265,41805,0.369090187
&#x1f3af; Last chance: Wall Décor from $3.74 – only until 11:59 pm!,112972,35291,0.31238714
Happy Canada Day!  Enjoy 10% OFF Everything and Free Shipping! &#x1f389;,112857,24244,0.214820525
4th of July Sale | Save up to 92% off,112808,34373,0.304703567
Up to -70% on ALL photo books & calendars! &#x2b50; Exclusively for you!,112530,43050,0.382564649
Huge sale on Metal Prints - Grab yours today!,112201,35179,0.31353553
4 days | Up to -93% on our absolute bestsellers!,111740,23695,0.21205477
&#x1f4f7; Photography Day Sale | Prices starting from just $3,111139,40987,0.368790434
Mystery Sale on ALL products! Just how much will you save?,110781,37676,0.340094421
Get 3 Canvases for the price of 2 - limited time!,110370,44778,0.405708073
"{% if contact.1 == '' %}{% if contact.1 == true %}, {{ contact.1 }}, your {% else %}Your{% endif %}{% else %}{% if contact.1 == true %}, {{ contact.1 }}, your {% else %}Your{% endif %}{% endif %}exclusive discount of up to 87% is waiting for you!",110054,33213,0.301788213
&#x23f0; Today Only! Wall & Home Décor starting at just $6,110022,33732,0.306593227
Your photos on our products starting from C$3.71,109896,31396,0.285688287
Gift for you: $7.90 off your next order! &#x26a1; Flash deal until noon tomorrow!,109586,37334,0.340682204
The perfect Valentine’s Gift? Personalized Canvases starting at C$6.67!,108852,35220,0.323558593
"&#x231b; Last Chance{% if contact.1 == '' %}{% if contact.1 == true %}, {{ contact.1 }}! {% else %}! {% endif %}{% else %}{% if contact.1 == true %}, {{ contact.1 }}! {% else %}! {% endif %}{% endif %}Secure 92% OFF our gratitude discount!",108808,29040,0.26689214
&#x1f525; Exclusive offer: Wall and Home Décor from $6.80,108758,59371,0.545900072
"{% if contact.1 == true %} {{ contact.1 }}, up {% else %}Up {% endif %} to 15% OFF +  Delivery Guarantee until midnight!",108608,34992,0.322186211
A special treat for a special day—75% OFF sitewide!,108470,37482,0.345551765
Summer's ending but the Sale is just starting! &#x1f31e;,108405,37687,0.347650016
&#x1f48c; Gift inspirations that make an impact! | From just $3.74,108246,32025,0.295853888
Last Chance! Canvas Prints up to 85% off,107232,38211,0.356339526
&#x1f381; Don’t wait for December! Save up to 15% on ALL products!,107023,29533,0.275950029
"{% if contact.1 == '' %}{% if contact.1 == true %} {{ contact.1 }},a {% else %}A {% endif %}{% else %}{% if contact.1 == true %} {{ contact.1 }}, a {% else %}A {% endif %}{% endif %}gift from our CEO: FREE Shipping just for you!",106690,36108,0.338438467
{% if contact.1 == true %} {{ contact.1 }}!{% else %} {% endif %} Time’s running out to bring your photos to life &#x1f4f8;,105129,32391,0.308107183
&#x23f3;Print now or miss out – up to 92% off Wall Décor.,105127,33954,0.322980776
"{% if contact.1 == '' %}{% if contact.1 == true %} {{ contact.1 }}, don't {% else %}Don't {% endif %}{% else %}{% if contact.1 == true %} {{ contact.1 }}, don't {% else %}Don't {% endif %}{% endif %}let this discount expire!",104603,35706,0.341347762
Only 48 hours &#x23f3; Discounts up to 92%,104208,28536,0.273836942
2 days! Huge savings on Canvases,104016,32352,0.311029072
"&#x23f1;&#xfe0f; Countdown is on: Up to -92%, only until tomorrow{% if contact.1 == '' %}{% if contact.1 == true %}, {{ contact.1 }}! {% else %}! {% endif %}{% else %}{% if contact.1 == true %}, {{ contact.1 }}! {% else %}! {% endif %}{% endif %}",102629,32542,0.317083865
FREE Shipping + up to 89% discount | Get it now! &#x1f525;,102320,29871,0.29193706
"Your Showroom is waiting! All bestsellers discounted{% if contact.1 == '' %}{% if contact.1 == true %}, {{ contact.1 }}! {% else %} ! {% endif %}{% else %}{% if contact.1 == true %}, {{ contact.1 }}! {% else %} ! {% endif %}{% endif %}",101964,33480,0.328351183
From $8.50 | Super size your savings: exclusive Cyber Monday discount inside &#x1f4b0;,101822,33873,0.332668775
Last 2 days: Prices from only $10,101796,34385,0.33778341
Photo Gifts from the heart&#x2763;&#xfe0f;Valentine's Day discount up to -83%!,101340,35941,0.354657588
"{% if contact.1 == true %}{{ contact.1 }}, create{% else %}Create{% endif %} something special for Valentine’s Day &#x1f495;",100912,40397,0.40031909
&#x1f4a5; Only 1 day left: Bestsellers from only $9.60,100620,26748,0.265831843
"Do you really want to let your code CD2ND24CRM expire, FIRSTNAME? &#x23f0;",100345,28850,0.287508097
&#x2728;Art That Speaks – Exclusive Canvas Offer Inside,99960,31048,0.310604242
Bestselling Canvas & Wall Décor now on SALE! From $3 &#x1f389;,99778,35353,0.354316583
Christmas Sale &#x1f384; Unwrap maximum discounts on Canvas Prints!,98731,33313,0.337411755
Flash Sale! Discounts of up to 84%,98439,36391,0.369680716
&#x2757; Hurry: Products from $6.40,98173,35829,0.364957779
Sunday Savings: Up to 87% off our Bestsellers &#x1f4a5;,97920,30496,0.311437908
Your Thank-you gift is here – hurry! Up to 92% off Wall Décor!,97659,32261,0.330343338
(48h) Massive savings! Your code J3ADY4XC expires soon!,97445,35206,0.361290985
Almost gone! Last chance to get Wall Décor at up to 92% off!,97439,28700,0.294543253
Epic Wall Décor deals starting from $3.87 – don’t miss out!,97217,28855,0.296810229
Prices from just $4.50 – Personalize your Photo Gifts now and save big!,97080,32574,0.335537701
&#x1f6a8; Final call: TOP Canvas Prints from $15,97014,30624,0.31566578
"&#x1f496; Thank you for loyalty, Name! Pre-Black Friday savings – up to 20% off",96777,30258,0.312656933
&#x26a1; Flash Sale | Prices from $8.05,96296,34858,0.361988037
Up to 88% off on everything &#x1f92f;,96035,47305,0.49258083
Until midnight! Wall Décor up to -92%,95956,25130,0.261890867
SALE! Up to 70% OFF on Wall Décor!,95454,33765,0.353730593
&#x1f303; Late-night deal: huge savings until 9 AM tomorrow!,94948,33611,0.353993765
Deck the Walls: Up to 81% Off Acrylic Prints ,94911,31252,0.329276902
&#x1f4f8; Camera Day! 15% discount - only today!,94839,25344,0.267231835
Up to 82% off |Transform your space with mega discounts,94792,31420,0.331462571
&#x1f381; Father’s Day special: Up to 85% off on Home Décor!,94122,28837,0.306378955
&#x23f0; Only till midnight: Save up to 79% on Prints,94038,25742,0.273740403
Valentine's Day SALE starts now &#x1f60d; Huge discounts on bestsellers!,93890,33660,0.358504633
Your favorite photos on Canvas: prices starting at just $15! &#x1f4f8;,93752,29144,0.310862702
Until midnight: most popular products at crazy low prices,93650,32976,0.352119594
Retrieving data. Wait a few seconds and try to cut or copy again.,93544,27026,0.28891217
48 hours only: top sellers up to 87% off!,93378,17805,0.190676605
Savings up to 81% on lovely Father's Day gifts,93334,34104,0.36539739
&#x1f6cd;&#xfe0f; Don’t miss out – Product Gallery deals from $2.61 end today,93294,29860,0.320063455
2nd Advent deal &#x1f384; prices from $3,93209,32867,0.352616164
A little reminder: up to 92% off your dream picks,93163,30332,0.325579898
"NEW! Photo Book, Calendar & Photo Card SALE – Up to 70% Off!",93076,31561,0.339088487
"&#x23f0; Last hours{% if contact.1 == true %}, {{ contact.1 }} -{% else %} -{% endif %} Grab your $10 discount!",92804,26965,0.290558597
Say ‘I Love You’ with a custom Canvas—ends soon!,92612,34080,0.36798687
"Name, these products are still avaliable for Christmas guarantee",92416,33794,0.365672611
"Attention – our SALE ends{% if contact.1 == true %}, {{ contact.1 }}!{% else %}!{% endif %} CYBER discounts today only!",92416,27728,0.300034626
"&#x1f385; Still in time for {% if contact.1 == true %}Christmas, {{ contact.1 }}!{% else %}Christmas!{% endif %} Shop gifts from $3!",92416,33794,0.365672611
"24h left | {% if contact.1 == '' %}{% if contact.1 == true %}{{ contact.1 }}, use{% else %}Use{% endif %}{% else %}{% if contact.1 == true %}{{ contact.1 }}, use{% else %}Use{% endif %}{% endif %} the last chance to get up to -81%! ",92350,25820,0.279588522
"Do you really want to let your code CS2ND24CRM expire{% if contact.1 == '' %}{% if contact.1 == true %}, {{ contact.1 }}? {% else %}? {% endif %}{% else %}{% if contact.1 == true %}, {{ contact.1 }}? {% else %}? {% endif %}{% endif %} &#x23f0;",92151,25354,0.275135376
"Are you really going to miss this massive discount{% if contact.1 == '' %}{% if contact.1 == true %, }{{ contact.1 }}?{% else %}?{% endif %}{% else %}{% if contact.1 == true %, }{{ contact.1 }}?{% else %}?{% endif %}{% endif %}",92146,26256,0.284939118
"&#x26a1; One-day Flash Sale for you{% if contact.1 == true %}, {{ contact.1 }}!{% else %}!{% endif %} | 25% EXTRA off!",92062,26750,0.290565054
"&#x1f389; Get up to 87% OFF before it’s gone{% if contact.1 == '' %}{% if contact.1 == true %}, {{ contact.1 }}! {% else %}! {% endif %}{% else %}{% if contact.1 == true %}, {{ contact.1 }}! {% else %}! {% endif %}{% endif %}",92054,28127,0.305548917
Last chance! Wall Decorations from $ 3.83 &#x23f0;,91990,50600,0.550059789
3 days only: Labor Day Sale with up to 85% off! &#x23f3;,91963,34076,0.370540326
