subject,sendings,opens,open_rate
"Thank you{% if contact.1 == '{{ contact.1 }}' %}{% if contact.1 == true %}, {{ contact.1 }}! {% else %}! {% endif %}{% else %}{% if contact.1 == true %}, {{ contact.1 }}! {% else %}! {% endif %}{% endif %}",64477108,17972995,0.278750018
"Your exclusive Photo Product offer awaits{% if contact.1 == true %}, {{ contact.1 }}!{% else %}!{% endif %}",43081180,12210189,0.283422808
"Your exclusive Photo Product offer awaits{% if contact.1 == '{{ contact.1 }}' %}{% if contact.1 == true %}, {{ contact.1 }}! {% else %}! {% endif %}{% else %}{% if contact.1 == true %}, {{ contact.1 }}! {% else %}! {% endif %}{% endif %}",41786220,11060178,0.264684817
Huge sale on Acrylic Prints  – from £7.78!,27661060,7716586,0.27896928
Sunday Savings! Canvases and Home Decorations from £6.50!,23897214,6232485,0.260803833
Chocolate Advent Calendar with your photo | NEW!,23743861,6762358,0.284804481
"Thank you for your trust{% if contact.1 == '' %}{% if contact.1 == true %}, {{ contact.1 }}!{% else %}!{% endif %}{% else %}{% if contact.1 == true %}, {{ contact.1 }}!{% else %}!{% endif %}{% endif %} &#x2764;&#xfe0f;",23682301,6968240,0.294238301
Last chance: Canvas SALE + extra discount | Up to -86%,23201712,5857504,0.252459991
"&#x1f385;&#x1f3fc; A hidden secret discount for you{% if contact.1 == '{{ contact.1 }}' %}{% if contact.1 == true %}, {{ contact.1 }}! {% else %}! {% endif %}{% else %}{% if contact.1 == true %}, {{ contact.1 }}! {% else %}! {% endif %}{% endif %}",23096348,6682273,0.289321628
"&#x1f31f; Your code TK4AK9FL is waiting to be redeemed! Act now{% if contact.1 == '{{ contact.1 }}' %}{% if contact.1 == true %}, {{ contact.1 }}! {% else %}! {% endif %}{% else %}{% if contact.1 == true %}, {{ contact.1 }}! {% else %}! {% endif %}{% endif %}",22799425,6506828,0.28539439
Limited-time offer! Canvas Prints from £4.50,22303690,5317076,0.238394454
"Go big, save big: Unlock your exclusive size-based discount! &#x1f6cd;&#xfe0f; | Up to -30% EXTRA",22086394,6237471,0.282412376
"&#x1f496; Thank you for loyalty{% if contact.1 == '' %}{% if contact.1 == true %}, {{ contact.1 }}!{% else %}!{% endif %}{% else %}{% if contact.1 == true %}, {{ contact.1 }}!{% else %}!{% endif %}{% endif %} Pre-Black Friday savings – up to 87% off",21898917,6465851,0.295258939
"Your exclusive Photo Product offer awaits{% if contact.1 == '' %}{% if contact.1 == true %}, {{ contact.1 }}!{% else %}!{% endif %}{% else %}{% if contact.1 == true %}, {{ contact.1 }}!{% else %}!{% endif %}{% endif %}",20451880,5856696,0.286364676
Review your best year with 10% off | Get Calendars from £2.70!,19364104,5475577,0.282769448
Huge sale on Acrylic Prints - Grab yours today!,19159645,5454792,0.284702143
"&#x1f525; Save 50% on your order – Hurry, offer ends soon!",19067555,5437106,0.285149617
Limited time offer – Wall Décor from just £2.55,18823442,5394769,0.286598434
"We thank you for your trust with up to 87% off{% if contact.1 == '{{ contact.1 }}' %}{% if contact.1 == true %}, {{ contact.1 }}! {% else %}! {% endif %}{% else %}{% if contact.1 == true %}, {{ contact.1 }}! {% else %}! {% endif %}{% endif %}&#x1f381;",18757095,5374519,0.286532589
Singles' Day starts early | Save up to 83% &#x1f389;,18130593,5300341,0.292342396
"From £4.50 – Save big before it’s gone{% if contact.1 == true %}, {{ contact.1 }}!{% else %}!{% endif %}",17948605,5017976,0.279574708
Mega Photo Board Sale | From just £2.49!,17929642,5208483,0.29049565
&#x1f384; Get {% if contact.1 == true %}ready {{ contact.1 }}! {% else %}ready! {% endif %} Christmas gifts up to 87% off!,17828209,4811209,0.269864965
&#x1f6a8; New sale: Wall Décor up to 79% off!,17516938,4622059,0.263862269
Uncover the secret &#x1f92b; Your exclusive deal is waiting!,17211772,3876871,0.225245315
"Thank you{% if contact.1 == '' %}{% if contact.1 == true %}, {{ contact.1 }}! {% else %}! {% endif %}{% else %}{% if contact.1 == true %}, {{ contact.1 }}! {% else %}! {% endif %}{% endif %}",17182773,5001366,0.291068619
"Thank you for your trust{% if contact.1 == true %}, {{ contact.1 }}!{% else %}!{% endif %} &#x2764;&#xfe0f;",17154902,4898804,0.285562925
"Up to 87% off everything? Yes, it’s real! &#x1f60d;",17014652,4368712,0.25676176
Wait… did you leave your summer on your phone?,16839177,4961993,0.294669567
"&#x1f381; Your code TK4AK9FL is ready to use - don’t miss out{% if contact.1 == true %}, {{ contact.1 }}! {% else %}! {% endif %}",16789516,4958053,0.295306488
The clock is ticking! Up to 83% off ends soon - act now!,16774236,4753433,0.283377019
Wow! Up to -87% on Canvas and Canvas Collage!,16714603,4625010,0.276704747
Gift for you: £6 off your next order! &#x1f381;,16681545,4840724,0.290184392
"{% if contact.1 == true %} {{ contact.1 }}, enjoy {% else %}Enjoy {% endif %} up to 87% off Canvases!",16549230,4085102,0.246845442
"A personal reminder for you{% if contact.1 == true %}, {{ contact.1 }}!{% else %}!{% endif %} | Don't let your personal voucher expire!",16480746,5157125,0.312918177
"Order gifts with guaranteed delivery until Christmas{% if contact.1 == true %}, {{ contact.1 }}!{% else %}!{% endif %} &#x1f69a;",16359355,4347661,0.265759928
Our team's must-haves – starting at £3.83! &#x2764;&#xfe0f;,16323824,4266718,0.261379809
"5 free MIXPIX? Yes, it’s happening – while stocks last! &#x1f6a8; ",16260142,4708790,0.289590952
&#x1f6a8; Late-night deal: up to 86% discount! ,16204492,4244752,0.261949094
&#x1f381; Don’t wait for December! Save up to 87% on ALL products!,16178934,4207135,0.260037837
"Exclusive reward just for you{% if contact.1 == '' %}{% if contact.1 == true %}, {{  contact.1 }}! {% else %}! {% endif %}{% else %}{% if contact.1 == true %}, {{  contact.1 }}! {% else %}! {% endif %}{% endif %}",16145053,4611809,0.285648427
&#x1f525; Huge savings on Photo Products – up to 80% off!,16053741,4503508,0.280527012
Wall Décor up to -87% off &#x1f60d; Get it now!,15939042,4250976,0.266702102
"Capture the moment: Canvas, Acrylic, and Aluminium Prints from just £3.96!",15837018,4398997,0.277766749
"Order gifts now to get them in time for Valentine's Day{% if contact.1 == '{{ contact.1 }}' %}{% if contact.1 == true %}, {{ contact.1 }}! {% else %}! {% endif %}{% else %}{% if contact.1 == true %}, {{ contact.1 }}! {% else %}! {% endif %}{% endif %}",15743044,4002607,0.254246066
Last two days to order &#x23f0; Chocolate filled Photo Advent Calendar,15659269,4329125,0.276457669
"{% if contact.1 == ' {{ contact.1 }}' %}{% if contact.1 == true %} {{ contact.1 }}, grab {% else %}Grab {% endif %}{% else %}{% if contact.1 == true %} {{ contact.1 }}, grab {% else %}Grab {% endif %}{% endif %} up to 87% off - our way of saying thank you! &#x1f4a5;",15624834,4464861,0.28575414
"Save up to 81% on Wall Décor bestsellers{% if contact.1 == '{{ contact.1 }}' %}{% if contact.1 == true %}, {{ contact.1 }}! {% else %}! {% endif %}{% else %}{% if contact.1 == true %}, {{ contact.1 }}! {% else %}! {% endif %}{% endif %}",15425000,3662920,0.237466451
"We're gifting you a Product for FREE{% if contact.1 == '{{ contact.1 }}' %}{% if contact.1 == true %}, {{ contact.1 }}{% else %}{% endif %}{% else %}{% if contact.1 == true %}, {{ contact.1 }}{% else %}{% endif %}{% endif %} | 48h only! ",15411291,4198016,0.272398724
Surprise! Get up to 30% EXTRA on everything—just in time for Mother’s Day!,15290642,4153632,0.271645363
Lowest prices ever on Acrylic Prints + discounts on ALL products &#x1f525;,14977999,4304540,0.287390859
"&#x1f389; Huge Savings on Bestsellers! Up to 83% off, starting at just £4!",14879831,3729534,0.250643572
"&#x26a0;&#xfe0f; Attention{% if contact.1 == true %}, {{ contact.1 }}!{% else %}!{% endif %} This deal is about to expire!",14855433,3988105,0.26846104
Your personal gallery in the Summer Sale! &#x2600;&#xfe0f;,14755373,4169206,0.282555107
&#x1f6a8; Price drop on Canvas Prints and Collages! Save now!,14755357,3579480,0.242588505
"Go big, save big: unlock your exclusive size-based discount! &#x1f6d2; Up to -30% EXTRA",14191904,4075386,0.287162737
Wall Décor up to -79% off &#x1f60d; Get it now!,14069572,3751138,0.266613512
"{% if contact.1 == true %}{{ contact.1 }}, you're{% else %}You're{% endif %} part of our 19 years story!",13978491,4142508,0.296348726
"Thank you{% if contact.1 == '{{ contact.1 }}' %}{% if contact.1 == true %}, {{ contact.1 }}! {% else %}! {% endif %}{% else %}{% if contact.1 == true %}, {{ contact.1 }}! {% else %}! {% endif %}{% endif %}&#x2764;&#xfe0f;",13894136,3334465,0.239990813
Up to 75% off! Get exclusive Christmas savings now! &#x2744;&#xfe0f;,13866162,3997573,0.288297007
Lowest prices of the year | Highest discounts on Bestsellers! &#x1f4b0;,13847936,3997924,0.288701796
Unlock EXTRA savings with code ARJ32AA1!,13716660,3782471,0.275757437
&#x1f9e8; Highest discounts on all Canvases!,13711754,3857033,0.281293918
&#x23f0; Final hours to enjoy the year’s biggest savings!,13670293,3768531,0.275673023
"Save today{% if contact.1 == true %}, {{ contact.1 }}!{% else %}!{% endif %}",13600520,3401440,0.25009632
Celebrate Women's Day: -25% EXTRA on EVERYTHING | Code in this email &#x1f440;,13540223,3402095,0.251258417
"{% if contact.1 == true %}{{ contact.1 }}, thank{% else %}Thank{% endif %} you for being part of our 19 years story!",13517673,4051681,0.299732136
Mega Discounts for Singles' Day | Available Only Today,13468297,3324161,0.246813758
"{% if contact.1 == '' %}{% if contact.1 == true %}{{ contact.1 }}, your{% else %}Your{% endif %}{% else %}{% if contact.1 == true %}{{ contact.1 }}, your{% else %}Your{% endif %}{% endif %} up to -87% on Canvas & Collages is about to expire! &#x1f4a5;",13432174,3907673,0.290918879
"{% if contact.1 == ' {{ contact.1 }}' %}{% if contact.1 == true %} {{ contact.1 }}, end {% else %}End {% endif %}{% else %}{% if contact.1 == true %} {{ contact.1 }}, end {% else %}End {% endif %}{% endif %}the year with incredible deals! &#x1f389;",13253556,3754315,0.283268505
"&#x2764;&#xfe0f; Thank you for your trust{% if contact.1 == '{{ contact.1 }}' %}{% if contact.1 == true %}, {{ contact.1 }}! {% else %}! {% endif %}{% else %}{% if contact.1 == true %}, {{ contact.1 }}! {% else %}! {% endif %}{% endif %}",13238197,3381722,0.255451856
"Today, we celebrate YOU{% if contact.1 == '{{ contact.1 }}' %}{% if contact.1 == true %}, {{ contact.1 }}! {% else %}! {% endif %}{% else %}{% if contact.1 == true %}, {{ contact.1 }}! {% else %}! {% endif %}{% endif %}&#x1f381;",12874420,3603676,0.279909775
Transform your space from just £3.83 + free MIXPIX!,12831829,3655492,0.284876926
&#x1f525; Exclusive offer: Wall and Home Décor from $10,12830342,3839443,0.299247128
"Go big, save big: unlock your exclusive size-based discount! &#x1f6cd;&#xfe0f; | Up to -30% EXTRA",12748909,3220328,0.252596359
"9 Canvas sizes, up to 71% off – Grab yours now!",12714562,3384743,0.266209957
Only today! Save up to 89%,12688316,3566004,0.281046279
"2 days left | {% if contact.1 == true %}{{ contact.1 }}, use {% else %}Use {% endif %}the last chance to get up to 79% off!",12687027,3494966,0.27547557
"BIG savings alert{% if contact.1 == true %}, {{ contact.1 }} &#x1f4a5;{% else %} &#x1f4a5;{% endif %} : get epic deals on Canvas & MixPix now",12438813,3428829,0.275655643
"Your Showroom is waiting! All bestsellers discounted{% if contact.1 == true %}, {{ contact.1 }}! {% else %}! {% endif %}",12321534,3539359,0.287249867
"{% if contact.1 == '' %}{% if contact.1 == true %}{{ contact.1 }}, you've {% else %}You've {% endif %}{% else %}{% if contact.1 == true %}{{ contact.1 }}, you've {% else %}You've {% endif %}{% endif %}received a special gift from us!",12315653,3657182,0.296953966
Top Canvas formats at unbeatable prices! &#x1f6d2;From £16!,12284847,2990534,0.243432743
&#x1f525; 24h Christmas Savings: Everything is discounted!,12253268,3458152,0.282222832
"{% if contact.1 == true %}{{ contact.1 }}, your {% else %}Your {% endif %}exclusive Wall Décor deal starts at £2.55 &#x1f525;",12138166,3404920,0.280513547
Limited time only: up to 80% off Premium Wall Décor! ,12100622,2664151,0.220166451
"We're gifting you a Product for free{% if contact.1 == '{{ contact.1 }}' %}{% if contact.1 == true %}, {{ contact.1 }}{% else %}{% endif %}{% else %}{% if contact.1 == true %}, {{ contact.1 }}{% else %}{% endif %}{% endif %} | 48h only! ",12032850,3109920,0.258452486
"Guess what? We've got a deal for you{% if contact.1 == '' %}{% if contact.1 == true %}, {{ contact.1 }}! {% else %}! {% endif %}{% else %}{% if contact.1 == true %}, {{ contact.1 }}! {% else %}! {% endif %}{% endif %}",11999290,3637035,0.303104184
Unbeatable prices: Canvas Print offer inside!,11917139,3909485,0.328055668
24 hours | Your EXTRA 25% discount expires today! &#x23f3;,11812452,3069014,0.259811765
&#x1f4e2; Massive Blanket Sale + Free Shipping!,11798177,3434386,0.291094633
"&#x1f4b0; Get up to £10 off your {% if contact.1 == true %}order, {{ contact.1 }}{% else %}order{% endif %} | Save now!",11791496,3196876,0.271117083
Singles' Day starts early - Save up to 83% on bestsellers! &#x1f389;,11691624,3333402,0.285110264
Save up to £140: Your cosy Blanket is waiting!,11676554,3045452,0.260817704
Our team's must-haves – starting at £4!,11653160,2954770,0.25355955
Prices from as low as £3.60 – personalise your Photo Gifts now and save big!,11641087,3207596,0.275540935
"Lowest Prices EVER on Aluminium – from just £4.99{% if contact.1 == '' %}{% if contact.1 == true %}, {{ contact.1 }}! {% else %}! {% endif %}{% else %}{% if contact.1 == true %}, {{ contact.1 }}! {% else %}! {% endif %}{% endif %}",11623803,3248450,0.279465335
&#x1f340; You’re in luck! Save more with code ZRN42EMQ,11597484,3269209,0.281889503
"Up to 87% discount for you{% if contact.1 == '' %}{% if contact.1 == true %}, {{ contact.1 }}! {% else %}! {% endif %}{% else %}{% if contact.1 == true %}, {{ contact.1 }}! {% else %}! {% endif %}{% endif %}",11445935,3201442,0.279701221
2 days only! Beautiful Canvases for the lowest prices!,11290636,3201670,0.283568614
Your code TK4AK9FL is expiring! &#x1f525; Be quick!,11280011,3191394,0.282924724
"Lowest prices EVER on Aluminium Prints{% if contact.1 == '' %}{% if contact.1 == true %}, {{ contact.1 }}! {% else %}! {% endif %}{% else %}{% if contact.1 == true %}, {{ contact.1 }}! {% else %}! {% endif %}{% endif %}",11230906,3297788,0.293635082
Hug Day Special: Up to 81% off cuddly Photo Products,11214534,2428969,0.216591166
10% off ALL Photo Books &#x2744;&#xfe0f; Starting from just £3.60,11200020,3175087,0.283489404
"&#x1f680; {% if contact.1 == '{{ contact.1 }}' %}{% if contact.1 == true %} Attention, {{ contact.1 }}! {% else %}Attention! {% endif %}{% else %}{% if contact.1 == true %} Attention, {{ contact.1 }}! {% else %}Attention! {% endif %}{% endif %} This deal is about to expire!",11115458,3122234,0.28089117
"Today, we celebrate YOU{% if contact.1 == '' %}{% if contact.1 == true %}, {{ contact.1 }}! {% else %}! {% endif %}{% else %}{% if contact.1 == true %}, {{ contact.1 }}! {% else %}! {% endif %}{% endif %} &#x1f381;",11088551,3087709,0.278459196
Mega offer: Photo Books & Calendars at rock-bottom prices! &#x1f389;,11085189,2787867,0.251494765
"&#x2764;&#xfe0f;  Thank you for your loyalty{% if contact.1 == '{{ contact.1 }}' %}{% if contact.1 == true %}, {{ contact.1 }}! {% else %}! {% endif %}{% else %}{% if contact.1 == true %}, {{ contact.1 }}! {% else %}! {% endif %}{% endif %} Early Black Friday discounts of up to 87% off",10972356,2680629,0.244307512
"{% if contact.1 == '' %}{% if contact.1 == true %}{{ contact.1 }}, this{% else %}This{% endif %}{% else %}{% if contact.1 == true %}{{ contact.1 }}, this{% else %}This{% endif %}{% endif %} offer is too good to miss: prices from just £3.96 &#x1f60d;",10905712,2971278,0.272451537
"Our gift: £10 discount{% if contact.1 == true %}, {{ contact.1 }}!{% else %}!{% endif %} &#x1f381; Hurry up and save!",10847329,3046506,0.280853102
(48 h) Transform your space from just £3.83 – time’s running out!,10709712,2708847,0.252933692
Final hours: Bestsellers from just £3.60,10690488,3060933,0.286323038
"Order gifts with guaranteed delivery until {% if contact.1 == '{{ contact.1 }}' %}{% if contact.1 == true %}Christmas, {{ contact.1 }}! {% else %}Christmas! {% endif %}{% else %}{% if contact.1 == true %}Christmas, {{ contact.1 }}! {% else %}Christmas! {% endif %}{% endif %} &#x1f69a;",10663076,2929547,0.274737515
"Lowest prices EVER on Metal Prints{% if contact.1 == '' %}{% if contact.1 == true %}, {{ contact.1 }}! {% else %}! {% endif %}{% else %}{% if contact.1 == true %}, {{ contact.1 }}! {% else %}! {% endif %}{% endif %}",10635701,3118361,0.293197505
"{% if contact.1 == true %}{{ contact.1 }}, unlock {% else %}Unlock {% endif %}your special offer &#x1f525; Up to 87% off Wall Décor!",10544577,2965331,0.281218583
"Act fast{% if contact.1 == '' %}{% if contact.1 == true %}, {{  contact.1 }}! {% else %}! {% endif %}{% else %}{% if contact.1 == true %}, {{  contact.1 }}! {% else %}! {% endif %}{% endif %} World Photography Day Flash Sale is on!",10362669,3001181,0.289614674
"Attention, emotions inside{% if contact.1 == true %}, {{ contact.1 }} | {% else %} | {% endif %} &#x1f381; Gift ideas with a discount guarantee ",10337600,2966475,0.286959739
"Our gift &#x1f381; Free MIXPIX + free shipping for you{% if contact.1 == true %}, {{ contact.1 }}!{% else %}!{% endif %}",10316689,3090697,0.299582259
Special thanks &#x1f49d; Enjoy your exclusive offer!,10279685,2668937,0.259632177
(24h) The best prices you’ve ever seen – are you ready?,10257657,3003076,0.292764322
"Your exclusive Photo Product offer awaits{% if contact.1 == true %}, {{ contact.1 }}! {% else %}! {% endif %}",10237740,3009944,0.294004732
"&#x1f6a8; Wait{% if contact.1 == '' %}{% if contact.1 == true %}, {{ contact.1 }}...{% else %}...{% endif %}{% else %}{% if contact.1 == true %}, {{ contact.1 }}...{% else %}...{% endif %}{% endif %} did you see what’s trending right now?",10204813,2835201,0.277829785
Save up to 80% on Home Decorations! &#x1f3e0;,10170503,2341371,0.230211918
"&#x23f3; Act fast{% if contact.1 == true %}, {{ contact.1 }}! {% else %}! {% endif %}Up to 87% OFF EVERYTHING – expires today! ",10077500,2691780,0.267107914
&#x26a1; Photo Products starting at £3.60 – Don’t miss out!,10006489,2526338,0.252469972
"Your Showroom is Waiting! Black Friday Sale on All Bestsellers{% if contact.1 == true %}, {{ contact.1 }}!{% else %}!{% endif %}",9988550,2605096,0.260808225
&#x1f48c; Gift inspirations that touch the heart! | From just £2.40,9985226,2468096,0.247174776
&#x1f525; Our #1 Canvas deal – Now £22 (Limited!),9774340,2711772,0.277437863
Your code L0U3KQ7Z is about to expire! &#x1f525; Don’t miss out – act now!,9735957,2851049,0.292837058
Super Size your savings: bigger canvas = bigger discount!&#x1f4b0;| From £4.20,9723672,2480570,0.255106301
24h only &#x23f0;: 50% off on your 2nd to 5th items!,9703748,2520600,0.259755303
2 days only | Unlock the HIGHEST discount levels!,9700098,2760684,0.284603723
Photo Christmas Ornaments &#x1f384; Get 8 for FREE!,9686845,2882353,0.297553331
"Up to 87% Off Everything? Yes, It’s Real! &#x1f60d;",9679684,2415420,0.249535005
&#x1f525; Massive price drop – Canvas from £3.83,9644853,2401361,0.248978497
"Your Showroom is waiting! Black Friday Sale on all bestsellers{% if contact.1 == true %}, {{ contact.1 }}!{% else %}!{% endif %}",9603453,2476642,0.257890782
Ends soon! You can still get Canvas Prints for lower prices!,9549924,2338606,0.244882158
"&#x1f497; Thank you for your trust{% if contact.1 == '{{ contact.1 }}' %}{% if contact.1 == true %}, {{ contact.1 }}! {% else %}! {% endif %}{% else %}{% if contact.1 == true %}, {{ contact.1 }}! {% else %}! {% endif %}{% endif %}",9548280,2331175,0.244146066
Wow! All Wall Decorations with up to -87% off!,9530288,2699603,0.283265626
Your personal Showroom deal of the year!,9470112,2691841,0.284245952
&#x1f525; Exclusive offer! Up to -81% on Canvases and Home Décor! ,9444238,2302092,0.243756246
"Attention - our SALE ends{% if contact.1 == true %}, {{ contact.1 }}!{% else %}!{% endif %} | CYBER discounts only today!",9420501,2832473,0.300671164
Crazy savings &#x1f4b0; Wall & Home Décor up to -81%,9404221,2492477,0.265038114
Wrap up the year with up to 10% extra off Calendars & Photo Books from just £6.00!,9396862,2715828,0.289014354
Massive demand: Code R2T85AOV extended one time only &#x1f92f;,9381823,2713437,0.289222788
"Cosy up for the holidays{% if contact.1 == '' %}{% if contact.1 == true %}, {{ contact.1 }}{% else %}!{% endif %}{% else %}{% if contact.1 == true %}, {{ contact.1 }}{% else %}!{% endif %}{% endif %} Up to 78% off | FREE DELIVERY",9379797,2695308,0.287352487
Your code FM2AHW70 expires soon! &#x1f525; Hurry!,9347426,2759217,0.295184685
"MEGA sale from £4.20 | Grab Canvases with size discount{% if contact.1 == '{{ contact.1 }}' %}{% if contact.1 == true %}, {{ contact.1 }}! {% else %}! {% endif %}{% else %}{% if contact.1 == true %}, {{ contact.1 }}! {% else %}! {% endif %}{% endif %}",9265497,2186203,0.235950969
"Your secret deal expires soon{% if contact.1 == '' %}{% if contact.1 == true %}, {{ contact.1 }}! {% else %}! {% endif %}{% else %}{% if contact.1 == true %}, {{ contact.1 }}! {% else %}! {% endif %}{% endif %} &#x26a1;&#xfe0f; Get the discount!",9250918,2757652,0.298094957
&#x1f4a5; Last chance for Christmas delivery + up to 87% off!,9197234,2683646,0.291788379
"&#x1f525; Big Canvas, bigger savings - 71% off now!",9166621,2594234,0.283008755
A gift for you: up to £10 discount with code QKE0DFXT &#x1f381;,9151327,2210290,0.241526721
&#x2764;&#xfe0f; Your exclusive offer arrived! Up to 85% off ,9143255,2298565,0.251394607
"(24h) No tricks, just treats: Halloween Flash Sale! ",9118609,2424789,0.265916545
&#x1f3f7;&#xfe0f; Prices start at just £5! Shop our BESTSELLERS now!,9112571,2247016,0.246584197
3-for-2 on our favourite gift ideas &#x2728; Don't miss out – only until midnight!,8968420,2281950,0.254442812
2 days only | Unlock the HIGHEST Valentine's discount levels!,8923225,2262500,0.253551827
WINTER SALE: Up to 80% off heartwarming Photo Gifts &#x26c4;,8907334,2487755,0.279292884
Spring Sale I Canvas Prints & Photo Gifts – Up to 92% OFF! &#x1f338;,8891507,2618856,0.294534549
Your exclusive Canvas offer – just £22 today!,8867241,2441203,0.275305814
Your code TK4AK9FL is about to expire! &#x1f525; Don’t miss out – act now!,8866160,2554480,0.288115712
&#x1f389; Surprise: More products added to Singles' Day Sale! &#x1f6cd;&#xfe0f; Don’t miss out!,8836797,2194249,0.248308182
&#x1f929; Prime Deals Sale– Bestsellers from just £2.40! ,8814128,2454715,0.278497771
Your photos as artwork – exclusive Canvas offer &#x2728; ,8812733,2470823,0.280369665
"24h Halloween Flash Sale - no tricks, only treats!",8785424,2527029,0.287638821
"{% if contact.1 == '' %}{% if contact.1 == true %}{{ contact.1 }}, don't{% else %}Don't{% endif %}{% else %}{% if contact.1 == true %}{{ contact.1 }}, don't{% else %}Don't{% endif %}{% endif %} let your discount of up to 81% slip away! ",8690364,2438792,0.280631743
Your free MIXBLOX is waiting | Use code GKXSGS57,8680936,2548584,0.29358401
"&#x1f4b0; Get £10 off your order{% if contact.1 == '{{ contact.1 }}' %}{% if contact.1 == true %}, {{ contact.1 }}!{% else %}!{% endif %}{% else %}{% if contact.1 == true %}, {{ contact.1 }}!{% else %}!{% endif %}{% endif %} | Save now!",8663789,2264237,0.261344892
2 days only | Unlock the ultimate Valentine’s discounts!,8623167,2252342,0.261196611
Your code LIWR6FBG is still valid! Extra discount on photo gifts!,8609685,2580893,0.299766252
"Up to 81% off your favourite pieces{% if contact.1 == true %}, {{ contact.1 }}! {% else %}! {% endif %}",8591601,2381948,0.277241459
"{% if contact.1 == true %}{{ contact.1 }}, stress-free {% else %}Stress-free {% endif %}holidays start with early gifts",8575484,2473355,0.288421621
"&#x1f525; Big Canvas, bigger savings - 87% off now!",8542899,2453610,0.287210466
Last-minute gift &#x23f0; Save 10% on vouchers! &#x1f385;&#x1f3fb;,8487513,2576172,0.303524955
Wow! Wall and Home Décor from only £5,8466258,2066340,0.244067686
"&#x1f4f8; Your photos, your decorations  – Starting at just £7.80!   ",8326494,1995904,0.239705211
"We're giving you £10{% if contact.1 == true %}, {{ contact.1 }}! {% else %}! {% endif %}Hurry and save!",8297766,2361379,0.284580091
"Our gift &#x1f381; Free MIXPIX & Ornaments for you{% if contact.1 == true %} , {{ contact.1 }}! {% else %}! {% endif %}",8291248,2467244,0.29757209
"Thank you{% if contact.1 == '{{ contact.1 }}' %}{% if contact.1 == true %}, {{ contact.1 }}! {% else %}! {% endif %}{% else %}{% if contact.1 == true %}, {{ contact.1 }}! {% else %}! {% endif %}{% endif %}Wall Décor from just €3.83 – exclusively for you!",8278901,2386439,0.288255531
"Last chance{% if contact.1 == '{{ contact.1 }}' %}{% if contact.1 == true %}, {{ contact.1 }}!{% else %}!{% endif %}{% else %}{% if contact.1 == true %}, {{ contact.1 }}!{% else %}!{% endif %}{% endif %} Most popular Canvas formats heavily discounted",8273475,2350236,0.284068786
"Save up to 91% & get everything in time for Christmas{% if contact.1 == true %}, {{ contact.1 }}! {% else %} ! {% endif %}",8268404,2374846,0.287219396
FLASH SALE &#x26a1;&#xfe0f; Acrylic Prints from £7.78 | Christmas delivery guarantee,8246955,2411886,0.292457762
Only 4 Days: Cosy autumn deals from £6.50,8200317,1914465,0.233462316
Breaking: Delivery guarantee extended for Christmas gifts! &#x1f525;,8181494,2334098,0.285289948
&#x1f381; Don’t wait for December! Save up to 92% on ALL products!,8161825,2319437,0.284181173
Prime Deals you can’t miss – up to 87% off in your Showroom!,8158678,2387415,0.292622775
